

================================================================
== Vivado HLS Report for 'relu_array_ap_fixed_4u_array_ap_fixed_8_2_0_0_0_4u_ReLU_config41_s'
================================================================
* Date:           Tue Jul 30 11:16:36 2024

* Version:        2019.2 (Build 2704478 on Wed Nov 06 22:10:23 MST 2019)
* Project:        myproject_prj
* Solution:       solution1
* Product family: virtexuplus
* Target device:  xcvu9p-flga2577-2-e


================================================================
== Performance Estimates
================================================================
+ Timing: 
    * Summary: 
    +--------+---------+----------+------------+
    |  Clock |  Target | Estimated| Uncertainty|
    +--------+---------+----------+------------+
    |ap_clk  | 2.78 ns | 2.100 ns |   0.35 ns  |
    +--------+---------+----------+------------+

+ Latency: 
    * Summary: 
    +---------+---------+-----------+-----------+------+------+---------+
    |  Latency (cycles) |   Latency (absolute)  |   Interval  | Pipeline|
    |   min   |   max   |    min    |    max    |  min |  max |   Type  |
    +---------+---------+-----------+-----------+------+------+---------+
    |     4099|     4099| 11.387 us | 11.387 us |  4099|  4099|   none  |
    +---------+---------+-----------+-----------+------+------+---------+

    + Detail: 
        * Instance: 
        N/A

        * Loop: 
        +---------------+---------+---------+----------+-----------+-----------+------+----------+
        |               |  Latency (cycles) | Iteration|  Initiation Interval  | Trip |          |
        |   Loop Name   |   min   |   max   |  Latency |  achieved |   target  | Count| Pipelined|
        +---------------+---------+---------+----------+-----------+-----------+------+----------+
        |- ReLUActLoop  |     4097|     4097|         3|          1|          1|  4096|    yes   |
        +---------------+---------+---------+----------+-----------+-----------+------+----------+

============================================================
+ Verbose Summary: Synthesis Manager
============================================================
InlineROM: 1
ExposeGlobal: 0
============================================================
+ Verbose Summary: CDFG Model
============================================================
IsTopModel: 0
ResetActiveHigh: 1
IsCombinational: 2
IsDatapathOnly: 0
HasWiredReturn: 1
HasMFsm: 0
HasVarLatency: 1
IsPipeline: 0
IsRtlPipelined: 0
IsInstanceOverlapped: 0
IsDontTouch: 0
HasImplIP: 0
IsGatedGlobalClock: 0

+ Individual pipeline summary: 
  * Pipeline-0: initiation interval (II) = 1, depth = 3


============================================================
+ Verbose Summary: Schedule
============================================================
* Number of FSM states : 5
* Pipeline : 1
  Pipeline-0 : II = 1, D = 3, States = { 2 3 4 }
* Dataflow Pipeline: 0

* FSM state transitions: 
1 --> 2 
2 --> 5 3 
3 --> 4 
4 --> 2 
5 --> 

* FSM state operations: 

State 1 <SV = 0> <Delay = 0.60>
ST_1 : Operation 6 [1/1] (0.00ns)   --->   "call void (...)* @_ssdm_op_SpecInterface(i8* %res_V_data_3_V, [8 x i8]* @ap_fifo_str, i32 0, i32 0, [1 x i8]* @p_str1753, i32 0, i32 0, [1 x i8]* @p_str1754, [1 x i8]* @p_str1755, [1 x i8]* @p_str1756, i32 2, i32 2, i32 16, i32 16, [1 x i8]* @p_str1757, [1 x i8]* @p_str1758)"   --->   Operation 6 'specinterface' <Predicate = true> <Delay = 0.00>
ST_1 : Operation 7 [1/1] (0.00ns)   --->   "call void (...)* @_ssdm_op_SpecInterface(i8* %res_V_data_2_V, [8 x i8]* @ap_fifo_str, i32 0, i32 0, [1 x i8]* @p_str1746, i32 0, i32 0, [1 x i8]* @p_str1747, [1 x i8]* @p_str1748, [1 x i8]* @p_str1749, i32 2, i32 2, i32 16, i32 16, [1 x i8]* @p_str1750, [1 x i8]* @p_str1751)"   --->   Operation 7 'specinterface' <Predicate = true> <Delay = 0.00>
ST_1 : Operation 8 [1/1] (0.00ns)   --->   "call void (...)* @_ssdm_op_SpecInterface(i8* %res_V_data_1_V, [8 x i8]* @ap_fifo_str, i32 0, i32 0, [1 x i8]* @p_str1739, i32 0, i32 0, [1 x i8]* @p_str1740, [1 x i8]* @p_str1741, [1 x i8]* @p_str1742, i32 2, i32 2, i32 16, i32 16, [1 x i8]* @p_str1743, [1 x i8]* @p_str1744)"   --->   Operation 8 'specinterface' <Predicate = true> <Delay = 0.00>
ST_1 : Operation 9 [1/1] (0.00ns)   --->   "call void (...)* @_ssdm_op_SpecInterface(i8* %res_V_data_0_V, [8 x i8]* @ap_fifo_str, i32 0, i32 0, [1 x i8]* @p_str1732, i32 0, i32 0, [1 x i8]* @p_str1733, [1 x i8]* @p_str1734, [1 x i8]* @p_str1735, i32 2, i32 2, i32 16, i32 16, [1 x i8]* @p_str1736, [1 x i8]* @p_str1737)"   --->   Operation 9 'specinterface' <Predicate = true> <Delay = 0.00>
ST_1 : Operation 10 [1/1] (0.00ns)   --->   "call void (...)* @_ssdm_op_SpecInterface(i8* %data_V_data_3_V, [8 x i8]* @ap_fifo_str, i32 0, i32 0, [1 x i8]* @p_str1725, i32 0, i32 0, [1 x i8]* @p_str1726, [1 x i8]* @p_str1727, [1 x i8]* @p_str1728, i32 2, i32 2, i32 16, i32 16, [1 x i8]* @p_str1729, [1 x i8]* @p_str1730)"   --->   Operation 10 'specinterface' <Predicate = true> <Delay = 0.00>
ST_1 : Operation 11 [1/1] (0.00ns)   --->   "call void (...)* @_ssdm_op_SpecInterface(i8* %data_V_data_2_V, [8 x i8]* @ap_fifo_str, i32 0, i32 0, [1 x i8]* @p_str1718, i32 0, i32 0, [1 x i8]* @p_str1719, [1 x i8]* @p_str1720, [1 x i8]* @p_str1721, i32 2, i32 2, i32 16, i32 16, [1 x i8]* @p_str1722, [1 x i8]* @p_str1723)"   --->   Operation 11 'specinterface' <Predicate = true> <Delay = 0.00>
ST_1 : Operation 12 [1/1] (0.00ns)   --->   "call void (...)* @_ssdm_op_SpecInterface(i8* %data_V_data_1_V, [8 x i8]* @ap_fifo_str, i32 0, i32 0, [1 x i8]* @p_str1711, i32 0, i32 0, [1 x i8]* @p_str1712, [1 x i8]* @p_str1713, [1 x i8]* @p_str1714, i32 2, i32 2, i32 16, i32 16, [1 x i8]* @p_str1715, [1 x i8]* @p_str1716)"   --->   Operation 12 'specinterface' <Predicate = true> <Delay = 0.00>
ST_1 : Operation 13 [1/1] (0.00ns)   --->   "call void (...)* @_ssdm_op_SpecInterface(i8* %data_V_data_0_V, [8 x i8]* @ap_fifo_str, i32 0, i32 0, [1 x i8]* @p_str1704, i32 0, i32 0, [1 x i8]* @p_str1705, [1 x i8]* @p_str1706, [1 x i8]* @p_str1707, i32 2, i32 2, i32 16, i32 16, [1 x i8]* @p_str1708, [1 x i8]* @p_str1709)"   --->   Operation 13 'specinterface' <Predicate = true> <Delay = 0.00>
ST_1 : Operation 14 [1/1] (0.60ns)   --->   "br label %1" [firmware/nnet_utils/nnet_activation_stream.h:41]   --->   Operation 14 'br' <Predicate = true> <Delay = 0.60>

State 2 <SV = 1> <Delay = 0.64>
ST_2 : Operation 15 [1/1] (0.00ns)   --->   "%i_0 = phi i13 [ 0, %0 ], [ %i, %ReLUActLoop ]"   --->   Operation 15 'phi' 'i_0' <Predicate = true> <Delay = 0.00>
ST_2 : Operation 16 [1/1] (0.64ns)   --->   "%icmp_ln41 = icmp eq i13 %i_0, -4096" [firmware/nnet_utils/nnet_activation_stream.h:41]   --->   Operation 16 'icmp' 'icmp_ln41' <Predicate = true> <Delay = 0.64> <Core = "Cmp">   --->   Core 25 'Cmp' <Latency = 0> <II = 1> <Delay = 0.58> <FuncUnit> <Opcode : 'icmp'> <InPorts = 2> <OutPorts = 1>
ST_2 : Operation 17 [1/1] (0.00ns)   --->   "%empty = call i32 (...)* @_ssdm_op_SpecLoopTripCount(i64 4096, i64 4096, i64 4096)"   --->   Operation 17 'speclooptripcount' 'empty' <Predicate = true> <Delay = 0.00>
ST_2 : Operation 18 [1/1] (0.54ns)   --->   "%i = add i13 %i_0, 1" [firmware/nnet_utils/nnet_activation_stream.h:41]   --->   Operation 18 'add' 'i' <Predicate = true> <Delay = 0.54> <Core = "AddSub">   --->   Core 14 'AddSub' <Latency = 0> <II = 1> <Delay = 0.54> <FuncUnit> <Opcode : 'add' 'sub'> <InPorts = 2> <OutPorts = 1>
ST_2 : Operation 19 [1/1] (0.00ns)   --->   "br i1 %icmp_ln41, label %2, label %ReLUActLoop" [firmware/nnet_utils/nnet_activation_stream.h:41]   --->   Operation 19 'br' <Predicate = true> <Delay = 0.00>

State 3 <SV = 2> <Delay = 1.21>
ST_3 : Operation 20 [1/1] (1.21ns)   --->   "%empty_118 = call { i8, i8, i8, i8 } @_ssdm_op_Read.ap_fifo.volatile.i8P.i8P.i8P.i8P(i8* %data_V_data_0_V, i8* %data_V_data_1_V, i8* %data_V_data_2_V, i8* %data_V_data_3_V)" [firmware/nnet_utils/nnet_activation_stream.h:44]   --->   Operation 20 'read' 'empty_118' <Predicate = (!icmp_ln41)> <Delay = 1.21> <Core = "FIFO_SRL">   --->   Core 36 'FIFO_SRL' <Latency = 0> <II = 1> <Delay = 1.45> <Storage> <Opcode : 'read' 'write' 'nbread' 'nbwrite'> <Ports = 0> <Width = 8> <Depth = 0> <FIFO>
ST_3 : Operation 21 [1/1] (0.00ns)   --->   "%tmp_data_0_V = extractvalue { i8, i8, i8, i8 } %empty_118, 0" [firmware/nnet_utils/nnet_activation_stream.h:44]   --->   Operation 21 'extractvalue' 'tmp_data_0_V' <Predicate = (!icmp_ln41)> <Delay = 0.00>
ST_3 : Operation 22 [1/1] (0.00ns)   --->   "%tmp_data_1_V = extractvalue { i8, i8, i8, i8 } %empty_118, 1" [firmware/nnet_utils/nnet_activation_stream.h:44]   --->   Operation 22 'extractvalue' 'tmp_data_1_V' <Predicate = (!icmp_ln41)> <Delay = 0.00>
ST_3 : Operation 23 [1/1] (0.00ns)   --->   "%tmp_data_2_V = extractvalue { i8, i8, i8, i8 } %empty_118, 2" [firmware/nnet_utils/nnet_activation_stream.h:44]   --->   Operation 23 'extractvalue' 'tmp_data_2_V' <Predicate = (!icmp_ln41)> <Delay = 0.00>
ST_3 : Operation 24 [1/1] (0.00ns)   --->   "%tmp_data_3_V = extractvalue { i8, i8, i8, i8 } %empty_118, 3" [firmware/nnet_utils/nnet_activation_stream.h:44]   --->   Operation 24 'extractvalue' 'tmp_data_3_V' <Predicate = (!icmp_ln41)> <Delay = 0.00>

State 4 <SV = 3> <Delay = 2.09>
ST_4 : Operation 25 [1/1] (0.00ns)   --->   "call void (...)* @_ssdm_op_SpecLoopName([12 x i8]* @p_str73) nounwind" [firmware/nnet_utils/nnet_activation_stream.h:41]   --->   Operation 25 'specloopname' <Predicate = (!icmp_ln41)> <Delay = 0.00>
ST_4 : Operation 26 [1/1] (0.00ns)   --->   "%tmp = call i32 (...)* @_ssdm_op_SpecRegionBegin([12 x i8]* @p_str73)" [firmware/nnet_utils/nnet_activation_stream.h:41]   --->   Operation 26 'specregionbegin' 'tmp' <Predicate = (!icmp_ln41)> <Delay = 0.00>
ST_4 : Operation 27 [1/1] (0.00ns)   --->   "call void (...)* @_ssdm_op_SpecPipeline(i32 -1, i32 1, i32 1, i32 0, [1 x i8]* @p_str38) nounwind" [firmware/nnet_utils/nnet_activation_stream.h:42]   --->   Operation 27 'specpipeline' <Predicate = (!icmp_ln41)> <Delay = 0.00>
ST_4 : Operation 28 [1/1] (0.58ns)   --->   "%icmp_ln1494 = icmp sgt i8 %tmp_data_0_V, 0" [firmware/nnet_utils/nnet_activation_stream.h:51]   --->   Operation 28 'icmp' 'icmp_ln1494' <Predicate = (!icmp_ln41)> <Delay = 0.58> <Core = "Cmp">   --->   Core 25 'Cmp' <Latency = 0> <II = 1> <Delay = 0.58> <FuncUnit> <Opcode : 'icmp'> <InPorts = 2> <OutPorts = 1>
ST_4 : Operation 29 [1/1] (0.30ns)   --->   "%tmp_data_0_V_34 = select i1 %icmp_ln1494, i8 %tmp_data_0_V, i8 0" [firmware/nnet_utils/nnet_activation_stream.h:51]   --->   Operation 29 'select' 'tmp_data_0_V_34' <Predicate = (!icmp_ln41)> <Delay = 0.30> <Core = "Sel">   --->   Core 26 'Sel' <Latency = 0> <II = 1> <Delay = 0.30> <FuncUnit> <Opcode : 'select'> <InPorts = 3> <OutPorts = 1>
ST_4 : Operation 30 [1/1] (0.58ns)   --->   "%icmp_ln1494_1 = icmp sgt i8 %tmp_data_1_V, 0" [firmware/nnet_utils/nnet_activation_stream.h:51]   --->   Operation 30 'icmp' 'icmp_ln1494_1' <Predicate = (!icmp_ln41)> <Delay = 0.58> <Core = "Cmp">   --->   Core 25 'Cmp' <Latency = 0> <II = 1> <Delay = 0.58> <FuncUnit> <Opcode : 'icmp'> <InPorts = 2> <OutPorts = 1>
ST_4 : Operation 31 [1/1] (0.30ns)   --->   "%tmp_data_1_V_34 = select i1 %icmp_ln1494_1, i8 %tmp_data_1_V, i8 0" [firmware/nnet_utils/nnet_activation_stream.h:51]   --->   Operation 31 'select' 'tmp_data_1_V_34' <Predicate = (!icmp_ln41)> <Delay = 0.30> <Core = "Sel">   --->   Core 26 'Sel' <Latency = 0> <II = 1> <Delay = 0.30> <FuncUnit> <Opcode : 'select'> <InPorts = 3> <OutPorts = 1>
ST_4 : Operation 32 [1/1] (0.58ns)   --->   "%icmp_ln1494_2 = icmp sgt i8 %tmp_data_2_V, 0" [firmware/nnet_utils/nnet_activation_stream.h:51]   --->   Operation 32 'icmp' 'icmp_ln1494_2' <Predicate = (!icmp_ln41)> <Delay = 0.58> <Core = "Cmp">   --->   Core 25 'Cmp' <Latency = 0> <II = 1> <Delay = 0.58> <FuncUnit> <Opcode : 'icmp'> <InPorts = 2> <OutPorts = 1>
ST_4 : Operation 33 [1/1] (0.30ns)   --->   "%tmp_data_2_V_34 = select i1 %icmp_ln1494_2, i8 %tmp_data_2_V, i8 0" [firmware/nnet_utils/nnet_activation_stream.h:51]   --->   Operation 33 'select' 'tmp_data_2_V_34' <Predicate = (!icmp_ln41)> <Delay = 0.30> <Core = "Sel">   --->   Core 26 'Sel' <Latency = 0> <II = 1> <Delay = 0.30> <FuncUnit> <Opcode : 'select'> <InPorts = 3> <OutPorts = 1>
ST_4 : Operation 34 [1/1] (0.58ns)   --->   "%icmp_ln1494_3 = icmp sgt i8 %tmp_data_3_V, 0" [firmware/nnet_utils/nnet_activation_stream.h:51]   --->   Operation 34 'icmp' 'icmp_ln1494_3' <Predicate = (!icmp_ln41)> <Delay = 0.58> <Core = "Cmp">   --->   Core 25 'Cmp' <Latency = 0> <II = 1> <Delay = 0.58> <FuncUnit> <Opcode : 'icmp'> <InPorts = 2> <OutPorts = 1>
ST_4 : Operation 35 [1/1] (0.30ns)   --->   "%tmp_data_3_V_34 = select i1 %icmp_ln1494_3, i8 %tmp_data_3_V, i8 0" [firmware/nnet_utils/nnet_activation_stream.h:51]   --->   Operation 35 'select' 'tmp_data_3_V_34' <Predicate = (!icmp_ln41)> <Delay = 0.30> <Core = "Sel">   --->   Core 26 'Sel' <Latency = 0> <II = 1> <Delay = 0.30> <FuncUnit> <Opcode : 'select'> <InPorts = 3> <OutPorts = 1>
ST_4 : Operation 36 [1/1] (1.21ns)   --->   "call void @_ssdm_op_Write.ap_fifo.volatile.i8P.i8P.i8P.i8P(i8* %res_V_data_0_V, i8* %res_V_data_1_V, i8* %res_V_data_2_V, i8* %res_V_data_3_V, i8 %tmp_data_0_V_34, i8 %tmp_data_1_V_34, i8 %tmp_data_2_V_34, i8 %tmp_data_3_V_34)" [firmware/nnet_utils/nnet_activation_stream.h:57]   --->   Operation 36 'write' <Predicate = (!icmp_ln41)> <Delay = 1.21> <Core = "FIFO_SRL">   --->   Core 36 'FIFO_SRL' <Latency = 0> <II = 1> <Delay = 1.45> <Storage> <Opcode : 'read' 'write' 'nbread' 'nbwrite'> <Ports = 0> <Width = 8> <Depth = 0> <FIFO>
ST_4 : Operation 37 [1/1] (0.00ns)   --->   "%empty_119 = call i32 (...)* @_ssdm_op_SpecRegionEnd([12 x i8]* @p_str73, i32 %tmp)" [firmware/nnet_utils/nnet_activation_stream.h:58]   --->   Operation 37 'specregionend' 'empty_119' <Predicate = (!icmp_ln41)> <Delay = 0.00>
ST_4 : Operation 38 [1/1] (0.00ns)   --->   "br label %1" [firmware/nnet_utils/nnet_activation_stream.h:41]   --->   Operation 38 'br' <Predicate = (!icmp_ln41)> <Delay = 0.00>

State 5 <SV = 2> <Delay = 0.00>
ST_5 : Operation 39 [1/1] (0.00ns)   --->   "ret void" [firmware/nnet_utils/nnet_activation_stream.h:59]   --->   Operation 39 'ret' <Predicate = true> <Delay = 0.00>


============================================================
+ Verbose Summary: Timing violations
============================================================
Target clock period: 2.78ns, clock uncertainty: 0.347ns.

 <State 1>: 0.603ns
The critical path consists of the following:
	multiplexor before 'phi' operation ('i') with incoming values : ('i', firmware/nnet_utils/nnet_activation_stream.h:41) [19]  (0.603 ns)

 <State 2>: 0.64ns
The critical path consists of the following:
	'phi' operation ('i') with incoming values : ('i', firmware/nnet_utils/nnet_activation_stream.h:41) [19]  (0 ns)
	'icmp' operation ('icmp_ln41', firmware/nnet_utils/nnet_activation_stream.h:41) [20]  (0.64 ns)

 <State 3>: 1.22ns
The critical path consists of the following:
	fifo read on port 'data_V_data_0_V' (firmware/nnet_utils/nnet_activation_stream.h:44) [28]  (1.22 ns)

 <State 4>: 2.1ns
The critical path consists of the following:
	'icmp' operation ('icmp_ln1494', firmware/nnet_utils/nnet_activation_stream.h:51) [33]  (0.581 ns)
	'select' operation ('tmp.data[0].V', firmware/nnet_utils/nnet_activation_stream.h:51) [34]  (0.303 ns)
	fifo write on port 'res_V_data_0_V' (firmware/nnet_utils/nnet_activation_stream.h:57) [41]  (1.22 ns)

 <State 5>: 0ns
The critical path consists of the following:


============================================================
+ Verbose Summary: Binding
============================================================
N/A
* FSMD analyzer results:
  - Output states:
 - Input state : 
  - Chain level:
	State 1
	State 2
	State 3
	State 4
	State 5


============================================================
+ Verbose Summary: Datapath Resource usage 
============================================================
N/A
