

================================================================
== Vivado HLS Report for 'zeropad2d_cl_array_ap_fixed_4u_array_ap_fixed_8_2_0_0_0_4u_config55_s'
================================================================
* Date:           Tue Jul 30 11:13:22 2024

* Version:        2019.2 (Build 2704478 on Wed Nov 06 22:10:23 MST 2019)
* Project:        myproject_prj
* Solution:       solution1
* Product family: virtexuplus
* Target device:  xcvu9p-flga2577-2-e


================================================================
== Performance Estimates
================================================================
+ Timing: 
    * Summary: 
    +--------+---------+----------+------------+
    |  Clock |  Target | Estimated| Uncertainty|
    +--------+---------+----------+------------+
    |ap_clk  | 2.78 ns | 2.431 ns |   0.35 ns  |
    +--------+---------+----------+------------+

+ Latency: 
    * Summary: 
    +---------+---------+-----------+-----------+------+------+---------+
    |  Latency (cycles) |   Latency (absolute)  |   Interval  | Pipeline|
    |   min   |   max   |    min    |    max    |  min |  max |   Type  |
    +---------+---------+-----------+-----------+------+------+---------+
    |     4291|     4291| 11.920 us | 11.920 us |  4291|  4291|   none  |
    +---------+---------+-----------+-----------+------+------+---------+

    + Detail: 
        * Instance: 
        N/A

        * Loop: 
        +------------------+---------+---------+----------+-----------+-----------+------+----------+
        |                  |  Latency (cycles) | Iteration|  Initiation Interval  | Trip |          |
        |     Loop Name    |   min   |   max   |  Latency |  achieved |   target  | Count| Pipelined|
        +------------------+---------+---------+----------+-----------+-----------+------+----------+
        |- PadMain         |     4224|     4224|        66|          -|          -|    64|    no    |
        | + CopyMain       |       64|       64|         1|          -|          -|    64|    no    |
        |- PadBottomWidth  |       65|       65|         1|          -|          -|    65|    no    |
        +------------------+---------+---------+----------+-----------+-----------+------+----------+

============================================================
+ Verbose Summary: Synthesis Manager
============================================================
InlineROM: 1
ExposeGlobal: 0
============================================================
+ Verbose Summary: CDFG Model
============================================================
IsTopModel: 0
ResetActiveHigh: 1
IsCombinational: 2
IsDatapathOnly: 0
HasWiredReturn: 1
HasMFsm: 0
HasVarLatency: 1
IsPipeline: 0
IsRtlPipelined: 0
IsInstanceOverlapped: 0
IsDontTouch: 0
HasImplIP: 0
IsGatedGlobalClock: 0


============================================================
+ Verbose Summary: Schedule
============================================================
* Number of FSM states : 4
* Pipeline : 0
* Dataflow Pipeline: 0

* FSM state transitions: 
1 --> 2 
2 --> 3 4 
3 --> 3 2 
4 --> 4 

* FSM state operations: 

State 1 <SV = 0> <Delay = 0.60>
ST_1 : Operation 5 [1/1] (0.00ns)   --->   "call void (...)* @_ssdm_op_SpecInterface(i8* %res_V_data_3_V, [8 x i8]* @ap_fifo_str, i32 0, i32 0, [1 x i8]* @p_str1025, i32 0, i32 0, [1 x i8]* @p_str1026, [1 x i8]* @p_str1027, [1 x i8]* @p_str1028, i32 2, i32 2, i32 16, i32 16, [1 x i8]* @p_str1029, [1 x i8]* @p_str1030)"   --->   Operation 5 'specinterface' <Predicate = true> <Delay = 0.00>
ST_1 : Operation 6 [1/1] (0.00ns)   --->   "call void (...)* @_ssdm_op_SpecInterface(i8* %res_V_data_2_V, [8 x i8]* @ap_fifo_str, i32 0, i32 0, [1 x i8]* @p_str1018, i32 0, i32 0, [1 x i8]* @p_str1019, [1 x i8]* @p_str1020, [1 x i8]* @p_str1021, i32 2, i32 2, i32 16, i32 16, [1 x i8]* @p_str1022, [1 x i8]* @p_str1023)"   --->   Operation 6 'specinterface' <Predicate = true> <Delay = 0.00>
ST_1 : Operation 7 [1/1] (0.00ns)   --->   "call void (...)* @_ssdm_op_SpecInterface(i8* %res_V_data_1_V, [8 x i8]* @ap_fifo_str, i32 0, i32 0, [1 x i8]* @p_str1011, i32 0, i32 0, [1 x i8]* @p_str1012, [1 x i8]* @p_str1013, [1 x i8]* @p_str1014, i32 2, i32 2, i32 16, i32 16, [1 x i8]* @p_str1015, [1 x i8]* @p_str1016)"   --->   Operation 7 'specinterface' <Predicate = true> <Delay = 0.00>
ST_1 : Operation 8 [1/1] (0.00ns)   --->   "call void (...)* @_ssdm_op_SpecInterface(i8* %res_V_data_0_V, [8 x i8]* @ap_fifo_str, i32 0, i32 0, [1 x i8]* @p_str1004, i32 0, i32 0, [1 x i8]* @p_str1005, [1 x i8]* @p_str1006, [1 x i8]* @p_str1007, i32 2, i32 2, i32 16, i32 16, [1 x i8]* @p_str1008, [1 x i8]* @p_str1009)"   --->   Operation 8 'specinterface' <Predicate = true> <Delay = 0.00>
ST_1 : Operation 9 [1/1] (0.00ns)   --->   "call void (...)* @_ssdm_op_SpecInterface(i8* %data_V_data_3_V, [8 x i8]* @ap_fifo_str, i32 0, i32 0, [1 x i8]* @p_str997, i32 0, i32 0, [1 x i8]* @p_str998, [1 x i8]* @p_str999, [1 x i8]* @p_str1000, i32 2, i32 2, i32 16, i32 16, [1 x i8]* @p_str1001, [1 x i8]* @p_str1002)"   --->   Operation 9 'specinterface' <Predicate = true> <Delay = 0.00>
ST_1 : Operation 10 [1/1] (0.00ns)   --->   "call void (...)* @_ssdm_op_SpecInterface(i8* %data_V_data_2_V, [8 x i8]* @ap_fifo_str, i32 0, i32 0, [1 x i8]* @p_str990, i32 0, i32 0, [1 x i8]* @p_str991, [1 x i8]* @p_str992, [1 x i8]* @p_str993, i32 2, i32 2, i32 16, i32 16, [1 x i8]* @p_str994, [1 x i8]* @p_str995)"   --->   Operation 10 'specinterface' <Predicate = true> <Delay = 0.00>
ST_1 : Operation 11 [1/1] (0.00ns)   --->   "call void (...)* @_ssdm_op_SpecInterface(i8* %data_V_data_1_V, [8 x i8]* @ap_fifo_str, i32 0, i32 0, [1 x i8]* @p_str983, i32 0, i32 0, [1 x i8]* @p_str984, [1 x i8]* @p_str985, [1 x i8]* @p_str986, i32 2, i32 2, i32 16, i32 16, [1 x i8]* @p_str987, [1 x i8]* @p_str988)"   --->   Operation 11 'specinterface' <Predicate = true> <Delay = 0.00>
ST_1 : Operation 12 [1/1] (0.00ns)   --->   "call void (...)* @_ssdm_op_SpecInterface(i8* %data_V_data_0_V, [8 x i8]* @ap_fifo_str, i32 0, i32 0, [1 x i8]* @p_str976, i32 0, i32 0, [1 x i8]* @p_str977, [1 x i8]* @p_str978, [1 x i8]* @p_str979, i32 2, i32 2, i32 16, i32 16, [1 x i8]* @p_str980, [1 x i8]* @p_str981)"   --->   Operation 12 'specinterface' <Predicate = true> <Delay = 0.00>
ST_1 : Operation 13 [1/1] (0.60ns)   --->   "br label %1" [firmware/nnet_utils/nnet_padding_stream.h:59]   --->   Operation 13 'br' <Predicate = true> <Delay = 0.60>

State 2 <SV = 1> <Delay = 0.60>
ST_2 : Operation 14 [1/1] (0.00ns)   --->   "%i1_0 = phi i7 [ 0, %0 ], [ %i, %PadMain_end ]"   --->   Operation 14 'phi' 'i1_0' <Predicate = true> <Delay = 0.00>
ST_2 : Operation 15 [1/1] (0.59ns)   --->   "%icmp_ln59 = icmp eq i7 %i1_0, -64" [firmware/nnet_utils/nnet_padding_stream.h:59]   --->   Operation 15 'icmp' 'icmp_ln59' <Predicate = true> <Delay = 0.59> <Core = "Cmp">   --->   Core 25 'Cmp' <Latency = 0> <II = 1> <Delay = 0.59> <FuncUnit> <Opcode : 'icmp'> <InPorts = 2> <OutPorts = 1>
ST_2 : Operation 16 [1/1] (0.00ns)   --->   "%empty = call i32 (...)* @_ssdm_op_SpecLoopTripCount(i64 64, i64 64, i64 64)"   --->   Operation 16 'speclooptripcount' 'empty' <Predicate = true> <Delay = 0.00>
ST_2 : Operation 17 [1/1] (0.40ns)   --->   "%i = add i7 %i1_0, 1" [firmware/nnet_utils/nnet_padding_stream.h:59]   --->   Operation 17 'add' 'i' <Predicate = true> <Delay = 0.40> <Core = "AddSub">   --->   Core 14 'AddSub' <Latency = 0> <II = 1> <Delay = 0.40> <FuncUnit> <Opcode : 'add' 'sub'> <InPorts = 2> <OutPorts = 1>
ST_2 : Operation 18 [1/1] (0.00ns)   --->   "br i1 %icmp_ln59, label %PadBottom_begin, label %PadMain_begin" [firmware/nnet_utils/nnet_padding_stream.h:59]   --->   Operation 18 'br' <Predicate = true> <Delay = 0.00>
ST_2 : Operation 19 [1/1] (0.00ns)   --->   "call void (...)* @_ssdm_op_SpecLoopName([8 x i8]* @p_str99) nounwind" [firmware/nnet_utils/nnet_padding_stream.h:59]   --->   Operation 19 'specloopname' <Predicate = (!icmp_ln59)> <Delay = 0.00>
ST_2 : Operation 20 [1/1] (0.00ns)   --->   "%tmp_s = call i32 (...)* @_ssdm_op_SpecRegionBegin([8 x i8]* @p_str99)" [firmware/nnet_utils/nnet_padding_stream.h:59]   --->   Operation 20 'specregionbegin' 'tmp_s' <Predicate = (!icmp_ln59)> <Delay = 0.00>
ST_2 : Operation 21 [1/1] (0.60ns)   --->   "br label %2" [firmware/nnet_utils/nnet_padding_stream.h:65]   --->   Operation 21 'br' <Predicate = (!icmp_ln59)> <Delay = 0.60>
ST_2 : Operation 22 [1/1] (0.00ns)   --->   "call void (...)* @_ssdm_op_SpecLoopName([10 x i8]* @p_str103) nounwind" [firmware/nnet_utils/nnet_padding_stream.h:75]   --->   Operation 22 'specloopname' <Predicate = (icmp_ln59)> <Delay = 0.00>
ST_2 : Operation 23 [1/1] (0.00ns)   --->   "%tmp = call i32 (...)* @_ssdm_op_SpecRegionBegin([10 x i8]* @p_str103)" [firmware/nnet_utils/nnet_padding_stream.h:75]   --->   Operation 23 'specregionbegin' 'tmp' <Predicate = (icmp_ln59)> <Delay = 0.00>
ST_2 : Operation 24 [1/1] (0.60ns)   --->   "br label %3" [firmware/nnet_utils/nnet_padding_stream.h:77]   --->   Operation 24 'br' <Predicate = (icmp_ln59)> <Delay = 0.60>

State 3 <SV = 2> <Delay = 2.43>
ST_3 : Operation 25 [1/1] (0.00ns)   --->   "%j3_0 = phi i7 [ 0, %PadMain_begin ], [ %j_11, %"fill_data<array<ap_fixed<8, 2, 0, 0, 0>, 4u>, array<ap_fixed<8, 2, 0, 0, 0>, 4u>, config55>.exit" ]"   --->   Operation 25 'phi' 'j3_0' <Predicate = true> <Delay = 0.00>
ST_3 : Operation 26 [1/1] (0.59ns)   --->   "%icmp_ln65 = icmp eq i7 %j3_0, -64" [firmware/nnet_utils/nnet_padding_stream.h:65]   --->   Operation 26 'icmp' 'icmp_ln65' <Predicate = true> <Delay = 0.59> <Core = "Cmp">   --->   Core 25 'Cmp' <Latency = 0> <II = 1> <Delay = 0.59> <FuncUnit> <Opcode : 'icmp'> <InPorts = 2> <OutPorts = 1>
ST_3 : Operation 27 [1/1] (0.00ns)   --->   "%empty_59 = call i32 (...)* @_ssdm_op_SpecLoopTripCount(i64 64, i64 64, i64 64)"   --->   Operation 27 'speclooptripcount' 'empty_59' <Predicate = true> <Delay = 0.00>
ST_3 : Operation 28 [1/1] (0.40ns)   --->   "%j_11 = add i7 %j3_0, 1" [firmware/nnet_utils/nnet_padding_stream.h:65]   --->   Operation 28 'add' 'j_11' <Predicate = true> <Delay = 0.40> <Core = "AddSub">   --->   Core 14 'AddSub' <Latency = 0> <II = 1> <Delay = 0.40> <FuncUnit> <Opcode : 'add' 'sub'> <InPorts = 2> <OutPorts = 1>
ST_3 : Operation 29 [1/1] (0.00ns)   --->   "br i1 %icmp_ln65, label %PadMain_end, label %"fill_data<array<ap_fixed<8, 2, 0, 0, 0>, 4u>, array<ap_fixed<8, 2, 0, 0, 0>, 4u>, config55>.exit"" [firmware/nnet_utils/nnet_padding_stream.h:65]   --->   Operation 29 'br' <Predicate = true> <Delay = 0.00>
ST_3 : Operation 30 [1/1] (0.00ns)   --->   "call void (...)* @_ssdm_op_SpecLoopName([9 x i8]* @p_str101) nounwind" [firmware/nnet_utils/nnet_padding_stream.h:65]   --->   Operation 30 'specloopname' <Predicate = (!icmp_ln65)> <Delay = 0.00>
ST_3 : Operation 31 [1/1] (1.21ns)   --->   "%empty_60 = call { i8, i8, i8, i8 } @_ssdm_op_Read.ap_fifo.volatile.i8P.i8P.i8P.i8P(i8* %data_V_data_0_V, i8* %data_V_data_1_V, i8* %data_V_data_2_V, i8* %data_V_data_3_V)" [firmware/nnet_utils/nnet_padding_stream.h:20->firmware/nnet_utils/nnet_padding_stream.h:66]   --->   Operation 31 'read' 'empty_60' <Predicate = (!icmp_ln65)> <Delay = 1.21> <Core = "FIFO_SRL">   --->   Core 36 'FIFO_SRL' <Latency = 0> <II = 1> <Delay = 1.45> <Storage> <Opcode : 'read' 'write' 'nbread' 'nbwrite'> <Ports = 0> <Width = 8> <Depth = 0> <FIFO>
ST_3 : Operation 32 [1/1] (0.00ns)   --->   "%tmp_data_0_V = extractvalue { i8, i8, i8, i8 } %empty_60, 0" [firmware/nnet_utils/nnet_padding_stream.h:20->firmware/nnet_utils/nnet_padding_stream.h:66]   --->   Operation 32 'extractvalue' 'tmp_data_0_V' <Predicate = (!icmp_ln65)> <Delay = 0.00>
ST_3 : Operation 33 [1/1] (0.00ns)   --->   "%tmp_data_1_V = extractvalue { i8, i8, i8, i8 } %empty_60, 1" [firmware/nnet_utils/nnet_padding_stream.h:20->firmware/nnet_utils/nnet_padding_stream.h:66]   --->   Operation 33 'extractvalue' 'tmp_data_1_V' <Predicate = (!icmp_ln65)> <Delay = 0.00>
ST_3 : Operation 34 [1/1] (0.00ns)   --->   "%tmp_data_2_V = extractvalue { i8, i8, i8, i8 } %empty_60, 2" [firmware/nnet_utils/nnet_padding_stream.h:20->firmware/nnet_utils/nnet_padding_stream.h:66]   --->   Operation 34 'extractvalue' 'tmp_data_2_V' <Predicate = (!icmp_ln65)> <Delay = 0.00>
ST_3 : Operation 35 [1/1] (0.00ns)   --->   "%tmp_data_3_V = extractvalue { i8, i8, i8, i8 } %empty_60, 3" [firmware/nnet_utils/nnet_padding_stream.h:20->firmware/nnet_utils/nnet_padding_stream.h:66]   --->   Operation 35 'extractvalue' 'tmp_data_3_V' <Predicate = (!icmp_ln65)> <Delay = 0.00>
ST_3 : Operation 36 [1/1] (1.21ns)   --->   "call void @_ssdm_op_Write.ap_fifo.volatile.i8P.i8P.i8P.i8P(i8* %res_V_data_0_V, i8* %res_V_data_1_V, i8* %res_V_data_2_V, i8* %res_V_data_3_V, i8 %tmp_data_0_V, i8 %tmp_data_1_V, i8 %tmp_data_2_V, i8 %tmp_data_3_V)" [firmware/nnet_utils/nnet_padding_stream.h:26->firmware/nnet_utils/nnet_padding_stream.h:66]   --->   Operation 36 'write' <Predicate = (!icmp_ln65)> <Delay = 1.21> <Core = "FIFO_SRL">   --->   Core 36 'FIFO_SRL' <Latency = 0> <II = 1> <Delay = 1.45> <Storage> <Opcode : 'read' 'write' 'nbread' 'nbwrite'> <Ports = 0> <Width = 8> <Depth = 0> <FIFO>
ST_3 : Operation 37 [1/1] (0.00ns)   --->   "br label %2" [firmware/nnet_utils/nnet_padding_stream.h:65]   --->   Operation 37 'br' <Predicate = (!icmp_ln65)> <Delay = 0.00>
ST_3 : Operation 38 [1/1] (0.00ns)   --->   "call void (...)* @_ssdm_op_SpecLoopName([9 x i8]* @p_str102) nounwind" [firmware/nnet_utils/nnet_padding_stream.h:69]   --->   Operation 38 'specloopname' <Predicate = (icmp_ln65)> <Delay = 0.00>
ST_3 : Operation 39 [1/1] (1.21ns)   --->   "call void @_ssdm_op_Write.ap_fifo.volatile.i8P.i8P.i8P.i8P(i8* %res_V_data_0_V, i8* %res_V_data_1_V, i8* %res_V_data_2_V, i8* %res_V_data_3_V, i8 0, i8 0, i8 0, i8 0)" [firmware/nnet_utils/nnet_padding_stream.h:15->firmware/nnet_utils/nnet_padding_stream.h:70]   --->   Operation 39 'write' <Predicate = (icmp_ln65)> <Delay = 1.21> <Core = "FIFO_SRL">   --->   Core 36 'FIFO_SRL' <Latency = 0> <II = 1> <Delay = 1.45> <Storage> <Opcode : 'read' 'write' 'nbread' 'nbwrite'> <Ports = 0> <Width = 8> <Depth = 0> <FIFO>
ST_3 : Operation 40 [1/1] (0.00ns)   --->   "%empty_61 = call i32 (...)* @_ssdm_op_SpecRegionEnd([8 x i8]* @p_str99, i32 %tmp_s)" [firmware/nnet_utils/nnet_padding_stream.h:72]   --->   Operation 40 'specregionend' 'empty_61' <Predicate = (icmp_ln65)> <Delay = 0.00>
ST_3 : Operation 41 [1/1] (0.00ns)   --->   "br label %1" [firmware/nnet_utils/nnet_padding_stream.h:59]   --->   Operation 41 'br' <Predicate = (icmp_ln65)> <Delay = 0.00>

State 4 <SV = 2> <Delay = 1.21>
ST_4 : Operation 42 [1/1] (0.00ns)   --->   "%j6_0 = phi i7 [ 0, %PadBottom_begin ], [ %j, %_ZrsILi32ELb0EEN11ap_int_baseIXT_EXT0_EE5RTypeIXT_EXT0_EE4arg1ERKS1_i.exit2.i.i.i.i.i.0 ]"   --->   Operation 42 'phi' 'j6_0' <Predicate = true> <Delay = 0.00>
ST_4 : Operation 43 [1/1] (0.59ns)   --->   "%icmp_ln77 = icmp eq i7 %j6_0, -63" [firmware/nnet_utils/nnet_padding_stream.h:77]   --->   Operation 43 'icmp' 'icmp_ln77' <Predicate = true> <Delay = 0.59> <Core = "Cmp">   --->   Core 25 'Cmp' <Latency = 0> <II = 1> <Delay = 0.59> <FuncUnit> <Opcode : 'icmp'> <InPorts = 2> <OutPorts = 1>
ST_4 : Operation 44 [1/1] (0.00ns)   --->   "%empty_62 = call i32 (...)* @_ssdm_op_SpecLoopTripCount(i64 65, i64 65, i64 65)"   --->   Operation 44 'speclooptripcount' 'empty_62' <Predicate = true> <Delay = 0.00>
ST_4 : Operation 45 [1/1] (0.40ns)   --->   "%j = add i7 %j6_0, 1" [firmware/nnet_utils/nnet_padding_stream.h:77]   --->   Operation 45 'add' 'j' <Predicate = true> <Delay = 0.40> <Core = "AddSub">   --->   Core 14 'AddSub' <Latency = 0> <II = 1> <Delay = 0.40> <FuncUnit> <Opcode : 'add' 'sub'> <InPorts = 2> <OutPorts = 1>
ST_4 : Operation 46 [1/1] (0.00ns)   --->   "br i1 %icmp_ln77, label %PadBottom_end, label %_ZrsILi32ELb0EEN11ap_int_baseIXT_EXT0_EE5RTypeIXT_EXT0_EE4arg1ERKS1_i.exit2.i.i.i.i.i.0" [firmware/nnet_utils/nnet_padding_stream.h:77]   --->   Operation 46 'br' <Predicate = true> <Delay = 0.00>
ST_4 : Operation 47 [1/1] (0.00ns)   --->   "call void (...)* @_ssdm_op_SpecLoopName([15 x i8]* @p_str104) nounwind" [firmware/nnet_utils/nnet_padding_stream.h:77]   --->   Operation 47 'specloopname' <Predicate = (!icmp_ln77)> <Delay = 0.00>
ST_4 : Operation 48 [1/1] (1.21ns)   --->   "call void @_ssdm_op_Write.ap_fifo.volatile.i8P.i8P.i8P.i8P(i8* %res_V_data_0_V, i8* %res_V_data_1_V, i8* %res_V_data_2_V, i8* %res_V_data_3_V, i8 0, i8 0, i8 0, i8 0)" [firmware/nnet_utils/nnet_padding_stream.h:15->firmware/nnet_utils/nnet_padding_stream.h:78]   --->   Operation 48 'write' <Predicate = (!icmp_ln77)> <Delay = 1.21> <Core = "FIFO_SRL">   --->   Core 36 'FIFO_SRL' <Latency = 0> <II = 1> <Delay = 1.45> <Storage> <Opcode : 'read' 'write' 'nbread' 'nbwrite'> <Ports = 0> <Width = 8> <Depth = 0> <FIFO>
ST_4 : Operation 49 [1/1] (0.00ns)   --->   "br label %3" [firmware/nnet_utils/nnet_padding_stream.h:77]   --->   Operation 49 'br' <Predicate = (!icmp_ln77)> <Delay = 0.00>
ST_4 : Operation 50 [1/1] (0.00ns)   --->   "%empty_63 = call i32 (...)* @_ssdm_op_SpecRegionEnd([10 x i8]* @p_str103, i32 %tmp)" [firmware/nnet_utils/nnet_padding_stream.h:80]   --->   Operation 50 'specregionend' 'empty_63' <Predicate = (icmp_ln77)> <Delay = 0.00>
ST_4 : Operation 51 [1/1] (0.00ns)   --->   "ret void" [firmware/nnet_utils/nnet_padding_stream.h:81]   --->   Operation 51 'ret' <Predicate = (icmp_ln77)> <Delay = 0.00>


============================================================
+ Verbose Summary: Timing violations
============================================================
Target clock period: 2.78ns, clock uncertainty: 0.347ns.

 <State 1>: 0.603ns
The critical path consists of the following:
	multiplexor before 'phi' operation ('i') with incoming values : ('i', firmware/nnet_utils/nnet_padding_stream.h:59) [19]  (0.603 ns)

 <State 2>: 0.603ns
The critical path consists of the following:
	multiplexor before 'phi' operation ('j') with incoming values : ('j', firmware/nnet_utils/nnet_padding_stream.h:65) [29]  (0.603 ns)

 <State 3>: 2.43ns
The critical path consists of the following:
	fifo read on port 'data_V_data_0_V' (firmware/nnet_utils/nnet_padding_stream.h:20->firmware/nnet_utils/nnet_padding_stream.h:66) [36]  (1.22 ns)
	fifo write on port 'res_V_data_0_V' (firmware/nnet_utils/nnet_padding_stream.h:26->firmware/nnet_utils/nnet_padding_stream.h:66) [41]  (1.22 ns)

 <State 4>: 1.22ns
The critical path consists of the following:
	fifo write on port 'res_V_data_0_V' (firmware/nnet_utils/nnet_padding_stream.h:15->firmware/nnet_utils/nnet_padding_stream.h:78) [60]  (1.22 ns)


============================================================
+ Verbose Summary: Binding
============================================================
N/A
* FSMD analyzer results:
  - Output states:
 - Input state : 
  - Chain level:
	State 1
	State 2
	State 3
	State 4


============================================================
+ Verbose Summary: Datapath Resource usage 
============================================================
N/A
